<?xml version="1.0" encoding="ISO-8859-1"?>
<!-- Generator: controlbuild -->

<NetworkIOCodeGenerationConfiguration xmlns:xsi="http://www.w3.org/2001/XMLSchema-instance" xsi:noNamespaceSchemaLocation="file:xsd/network_io_patterns.xsd">
	<Network PROTOCOL="ETH">
		<NetworkVariable Tag="$1">
			<Performer Receiver="currentIO" Selector="type" />
		</NetworkVariable>
		<NetworkVariable Tag="$2">
			<Performer Receiver="currentIO" Selector="index" />
		</NetworkVariable>
		<NetworkVariable Tag="$3">
			<Performer Receiver="currentNetwork" Selector="protocol" />
		</NetworkVariable>
		<NetworkVariable Tag="$4">
			<Performer Receiver="currentFrame" Selector="name" />
		</NetworkVariable>
		<NetworkVariable Tag="$5">
			<Performer Receiver="currentSignal" Selector="startBit" />
		</NetworkVariable>
		<NetworkVariable Tag="$6">
			<Performer Receiver="currentIO" Selector="name" />
		</NetworkVariable>
		<NetworkVariable Tag="$7">
			<Performer Receiver="currentSignal" Selector="name" />
		</NetworkVariable>
		<NetworkIOPatterns>
			<NetworkInputPattern>/* $6 */ P_$1(memHeader, $2)-&gt;CB_current_value = /* $7 */ $3_Extract_$1(&quot;$4&quot;, $5);</NetworkInputPattern>
			<NetworkOutputPattern>/* $7 */ $3_Compact_$1(/* $6  */ P_$1(memHeader, $2)-&gt;CB_current_value, &quot;$4&quot;, $5);</NetworkOutputPattern>
		</NetworkIOPatterns>
	</Network>
	<Network PROTOCOL="CAN">
		<NetworkVariable Tag="$1">
			<Performer Receiver="currentIO" Selector="type" />
		</NetworkVariable>
		<NetworkVariable Tag="$2">
			<Performer Receiver="currentIO" Selector="index" />
		</NetworkVariable>
		<NetworkVariable Tag="$3">
			<Performer Receiver="currentNetwork" Selector="protocol" />
		</NetworkVariable>
		<NetworkVariable Tag="$4">
			<Performer Receiver="currentFrame" Selector="identifier" />
		</NetworkVariable>
		<NetworkVariable Tag="$5">
			<Performer Receiver="currentSignal" Selector="startBit" />
		</NetworkVariable>
		<NetworkVariable Tag="$6">
			<Performer Receiver="currentIO" Selector="name" />
		</NetworkVariable>
		<NetworkVariable Tag="$7">
			<Performer Receiver="currentSignal" Selector="name" />
		</NetworkVariable>
		<NetworkIOPatterns>
			<NetworkInputPattern>/* $6 */ P_$1(memHeader, $2)-&gt;CB_current_value = /* $7 */ $3_Extract_$1($4, $5);</NetworkInputPattern>
			<NetworkOutputPattern>/* $7 */ $3_Compact_$1(/* $6  */ P_$1(memHeader, $2)-&gt;CB_current_value, $4, $5);</NetworkOutputPattern>
		</NetworkIOPatterns>
	</Network>
</NetworkIOCodeGenerationConfiguration>